{"$schema":"https://json-schema.org/draft/2020-12/schema","type":"object","additionalProperties":false,"required":["authorization_id","dataset_id","package_digest","manifest_hash","proposal_hash","plan_hash","rollback_hash","canonical_index_hash","taxonomy_hash","legal_schema_hash","policy_hash","issued_at","expires_at","revoked","single_use","consumed","authorizers","capabilities","files","protected_pr","technical_review"],"properties":{"authorization_id":{"type":"string","minLength":1},"dataset_id":{"const":"DATASET-002"},"package_digest":{"type":"string","pattern":"^sha256:[a-f0-9]{64}$"},"manifest_hash":{"type":"string"},"proposal_hash":{"type":"string"},"plan_hash":{"type":"string"},"rollback_hash":{"type":"string"},"canonical_index_hash":{"type":"string"},"taxonomy_hash":{"type":"string"},"legal_schema_hash":{"type":"string"},"policy_hash":{"type":"string"},"issued_at":{"type":"string","format":"date-time"},"expires_at":{"type":"string","format":"date-time"},"revoked":{"type":"boolean"},"single_use":{"const":true},"consumed":{"type":"boolean"},"authorizers":{"type":"array","minItems":1,"maxItems":1,"items":{"type":"object","additionalProperties":false,"required":["identity","role","decision","package_digest"],"properties":{"identity":{"const":"oalexandreoliveira"},"role":{"const":"final_authorizer"},"decision":{"enum":["approve","deny"]},"package_digest":{"type":"string"},"synthetic":{"type":"boolean"}}}},"capabilities":{"type":"array","uniqueItems":true,"items":{"enum":["validate_authorization","canonical_write_local","commit_local","push","open_pr_by_executor","merge","publisher","deploy","publish"]}},"files":{"type":"array","minItems":1,"uniqueItems":true,"items":{"type":"string"}},"protected_pr":{"type":"object","additionalProperties":false,"required":["repository","number","url","author_login","base_branch","protected","state"],"properties":{"repository":{"const":"oalexandreoliveira/predator-news"},"number":{"type":"integer","minimum":1},"url":{"type":"string","format":"uri"},"author_login":{"const":"oalexandreoliveira"},"base_branch":{"const":"main"},"protected":{"const":true},"state":{"enum":["open","merged"]}}},"technical_review":{"type":"object","additionalProperties":false,"required":["completed","reviewer_id","report_hash","reservations","authorizer_acknowledged"],"properties":{"completed":{"const":true},"reviewer_id":{"type":"string","minLength":1},"report_hash":{"type":"string","pattern":"^sha256:[a-f0-9]{64}$"},"reservations":{"type":"array","items":{"type":"string"}},"authorizer_acknowledged":{"type":"boolean"}}}}}
