{"authorization_id":"authorization-synthetic-fixture","dataset_id":"DATASET-002","package_digest":"CURRENT","manifest_hash":"CURRENT","proposal_hash":"CURRENT","plan_hash":"CURRENT","rollback_hash":"CURRENT","canonical_index_hash":"CURRENT","taxonomy_hash":"CURRENT","legal_schema_hash":"CURRENT","policy_hash":"CURRENT","issued_at":"2026-08-08T00:00:00Z","expires_at":"2026-08-09T00:00:00Z","revoked":false,"single_use":true,"consumed":false,"authorizers":[{"identity":"oalexandreoliveira","role":"final_authorizer","decision":"approve","package_digest":"CURRENT","synthetic":true}],"capabilities":["canonical_write_local","commit_local"],"files":["data/jurisprudencia/synthetic.yaml"],"protected_pr":{"repository":"oalexandreoliveira/predator-news","number":999,"url":"https://example.invalid/synthetic-pr/999","author_login":"oalexandreoliveira","base_branch":"main","protected":true,"state":"open"},"technical_review":{"completed":true,"reviewer_id":"reviewer-synthetic","report_hash":"sha256:aaaaaaaaaaaaaaaaaaaaaaaaaaaaaaaaaaaaaaaaaaaaaaaaaaaaaaaaaaaaaaaa","reservations":[],"authorizer_acknowledged":false}}
